{
  "task_id": "debugging-loop-s6-fixture",
  "task": "project source-backed debugging loop context into the read-only Resource Observatory inspector",
  "work_type": "engineering",
  "task_shape": {
    "repeated": true,
    "decomposable": false,
    "independent_units": false,
    "stages_depend_on_previous_output": true,
    "requires_judgment": "medium",
    "objective_verification_available": true,
    "state_required": false
  },
  "risk": {
    "risk_level": "medium",
    "touches_sensitive_context": false,
    "external_side_effect": false,
    "irreversible_action_possible": false
  },
  "recommended_vehicle": {
    "type": "loop",
    "rationale": "A bounded corrective loop is proportional when a small reproducible failure and focused test are present."
  },
  "recommended_pattern": {
    "type": "loop_until_done",
    "rationale": "The focused test is the objective stop condition; iteration and budget limits remain mandatory."
  },
  "required_controls": {
    "state_required": false,
    "objective_gate_required": true,
    "maker_checker_required": false,
    "human_review_required": true,
    "token_budget_required": true,
    "audit_record_required": true
  },
  "decision": {
    "verdict": "approved_with_constraints",
    "notes": "Fixture-only selection: maximum three iterations, explicit budget, evidence per iteration and human review before merge."
  }
}
