{
  "task_id": "s7-debugging-unavailable-iterations",
  "task": "Stop the Resource Observatory inspector from presenting an unreported loop iteration count as zero",
  "work_type": "engineering",
  "task_shape": {
    "repeated": true,
    "decomposable": false,
    "independent_units": false,
    "stages_depend_on_previous_output": true,
    "requires_judgment": "low",
    "objective_verification_available": true,
    "state_required": false
  },
  "risk": {
    "risk_level": "low",
    "touches_sensitive_context": false,
    "external_side_effect": false,
    "irreversible_action_possible": false
  },
  "recommended_vehicle": {
    "type": "loop",
    "rationale": "A focused component test provides a deterministic pass or fail signal for this bounded presentation defect."
  },
  "recommended_pattern": {
    "type": "loop_until_done",
    "rationale": "The loop must stop as soon as the focused inspector test passes and may not exceed three iterations."
  },
  "required_controls": {
    "state_required": false,
    "objective_gate_required": true,
    "maker_checker_required": false,
    "human_review_required": true,
    "token_budget_required": true,
    "audit_record_required": true
  },
  "decision": {
    "verdict": "approved_with_constraints",
    "notes": "Maximum three iterations; 30 minute and 8000 token budgets; evidence per iteration; human review required before merge."
  }
}
