{
  "task_id": "ci-triage-2026-w23",
  "task": "triage new CI failures, classify by failure type, route to owner or fix queue",
  "work_type": "engineering",
  "task_shape": {
    "repeated": true,
    "decomposable": true,
    "independent_units": true,
    "stages_depend_on_previous_output": false,
    "requires_judgment": "low",
    "objective_verification_available": true,
    "state_required": true
  },
  "risk": {
    "risk_level": "medium",
    "touches_sensitive_context": false,
    "external_side_effect": false,
    "irreversible_action_possible": false
  },
  "recommended_vehicle": {
    "type": "loop",
    "rationale": "recurring work with uncertain volume per run; each run is bounded and restartable"
  },
  "recommended_pattern": {
    "type": "scheduled_stateful_loop",
    "rationale": "recurrence plus persistent triage state; each run opens with a classify_and_act stage that types the failure before routing it"
  },
  "required_controls": {
    "state_required": true,
    "objective_gate_required": true,
    "maker_checker_required": false,
    "human_review_required": false,
    "token_budget_required": true,
    "audit_record_required": true
  },
  "decision": {
    "verdict": "approved_with_constraints",
    "notes": "approved while the stop condition holds: a run ends when the new-failure queue is empty or the budget is reached; any action beyond classification and routing escalates to human review"
  }
}
